--------[ AIDA64 Engineer ]---------------------------------------------------------------------------------------------

    Version                                           AIDA64 v7.40.7100/de
    Benchmark Modul                                   4.7.907.8-x64
    Homepage                                          http://www.aida64.com/
    Berichtsart                                       Kurzbericht
    Computer                                          LAPTOP-AMELIE
    Ersteller                                         Amelie
    Betriebssystem                                    Microsoft Windows 11 Pro 10.0.22000.2538 (Win11 21H2 RTM)
    Datum                                             2025-02-11
    Zeit                                              10:22


--------[ Energieverwaltung ]-------------------------------------------------------------------------------------------

    Energieverwaltungs Eigenschaften:
      Aktuelle Stromquelle                              Akku
      Akkustatus                                        31 % (Unterer Wert)
      Akkulaufzeit gesamt                               Unbekannt
      Verbleibende Akkulaufzeit                         6309 Sek. (1 Stunden, 45 Min., 9 Sek.)

    Akkueigenschaften:
      Ger‰tename                                        DELL GPM0336
      Hersteller                                        SMP
      Seriennummer                                      708
      Eindeutige ID                                     708SMPDELL GPM0336
      Akku Typ                                          Wiederaufladbar Li-Ion
      Geplante Kapazit‰t                                97003 mWh
      Vollaufgeladene Kapazit‰t                         97003 mWh
      Momentane Kapazit‰t                               30107 mWh  (31 %)
      Akkuspannung                                      11.099 V
      Verschleiﬂlevel                                   0 %
      Leistungsstand                                    Entlade
      Entladeanteil                                     10876 mW


--------[ Debug - PCI ]-------------------------------------------------------------------------------------------------

    B00 D00 F00:  Intel Skylake-H - Host Bridge/DRAM Controller [R0]
                  
      Offset 000:  86 80 10 19  06 00 90 20  07 00 00 06  00 00 00 00 
      Offset 010:  00 00 00 00  00 00 00 00  00 00 00 00  00 00 00 00 
      Offset 020:  00 00 00 00  00 00 00 00  00 00 00 00  28 10 BF 07 
      Offset 030:  00 00 00 00  E0 00 00 00  00 00 00 00  00 00 00 00 
      Offset 040:  01 90 D1 FE  00 00 00 00  01 00 D1 FE  00 00 00 00 
      Offset 050:  C1 02 00 00  B9 00 00 00  47 00 70 7F  A7 00 00 7A 
      Offset 060:  03 00 00 F0  00 00 00 00  01 80 D1 FE  00 00 00 00 
      Offset 070:  00 00 00 FE  03 00 00 00  00 0C 00 FE  7F 00 00 00 
      Offset 080:  10 11 11 11  11 11 11 00  1A 00 00 00  00 00 00 00 
      Offset 090:  01 00 00 FE  03 00 00 00  01 00 70 7E  04 00 00 00 
      Offset 0A0:  01 00 00 00  04 00 00 00  01 00 80 7E  04 00 00 00 
      Offset 0B0:  01 00 80 7B  01 00 00 7B  01 00 00 7A  01 00 80 7F 
      Offset 0C0:  00 00 00 00  00 00 00 00  00 00 00 00  00 00 00 00 
      Offset 0D0:  00 00 00 00  00 00 00 00  00 00 00 00  00 00 00 00 
      Offset 0E0:  09 00 10 01  79 26 01 62  DC 00 E4 B6  00 C0 06 00 
      Offset 0F0:  00 00 00 00  C8 0F 03 00  00 00 00 00  00 00 00 00 

    B00 D01 F00:  Intel Skylake - PCI Express x16 Controller [R0]
                  
      Offset 000:  86 80 01 19  00 04 10 00  07 00 04 06  00 00 81 00 
      Offset 010:  00 00 00 00  00 00 00 00  00 01 01 00  E0 E0 00 00 
      Offset 020:  00 EC 00 ED  01 C0 F1 D1  00 00 00 00  00 00 00 00 
      Offset 030:  00 00 00 00  88 00 00 00  00 00 00 00  00 01 00 00 
      Offset 040:  00 00 00 00  00 00 00 00  00 00 00 00  00 00 00 00 
      Offset 050:  00 00 00 00  00 00 00 00  00 00 00 00  00 00 00 00 
      Offset 060:  00 00 00 00  00 00 00 00  00 00 00 00  00 00 00 00 
      Offset 070:  00 00 00 00  00 00 00 00  C5 21 1F 00  00 00 00 0A 
      Offset 080:  01 90 03 C8  0B 00 00 00  0D 80 00 00  28 10 BF 07 
      Offset 090:  05 A0 00 00  38 01 E0 FE  00 00 00 00  00 00 00 00 
      Offset 0A0:  10 00 42 01  01 80 00 00  20 00 00 00  03 AD 61 02 
      Offset 0B0:  40 00 01 D1  80 25 0C 00  00 00 48 00  08 00 00 00 
      Offset 0C0:  00 00 00 00  80 0B 08 00  00 04 00 00  0E 00 00 00 
      Offset 0D0:  43 00 1E 00  00 00 00 00  00 00 00 00  00 00 00 00 
      Offset 0E0:  00 00 00 00  00 00 00 00  00 00 00 00  00 00 00 00 
      Offset 0F0:  00 60 01 00  4E 01 01 20  00 00 00 00  E0 00 10 00 

    B00 D02 F00:  Intel Skylake-H GT2 - Integrated Graphics Controller [R0]
                  
      Offset 000:  86 80 1B 19  07 04 10 00  06 00 00 03  00 00 00 00 
      Offset 010:  04 00 00 EB  00 00 00 00  0C 00 00 80  00 00 00 00 
      Offset 020:  01 F0 00 00  00 00 00 00  00 00 00 00  28 10 BF 07 
      Offset 030:  00 00 00 00  40 00 00 00  00 00 00 00  00 01 00 00 
      Offset 040:  09 70 0C 01  79 26 01 62  DC 00 E4 B6  00 00 00 00 
      Offset 050:  C1 02 00 00  B9 00 00 00  00 00 00 00  01 00 80 7B 
      Offset 060:  00 00 01 00  00 00 00 00  00 00 00 00  00 00 00 00 
      Offset 070:  10 AC 92 00  00 80 00 10  00 00 00 00  00 00 00 00 
      Offset 080:  00 00 00 00  00 00 00 00  00 00 00 00  00 00 00 00 
      Offset 090:  00 00 00 00  00 00 00 00  00 00 00 00  00 00 00 00 
      Offset 0A0:  00 00 00 00  00 00 00 00  00 00 00 00  05 D0 01 00 
      Offset 0B0:  18 04 E0 FE  00 00 00 00  00 00 00 00  00 00 00 00 
      Offset 0C0:  00 00 00 00  00 00 00 00  00 00 00 00  00 00 00 00 
      Offset 0D0:  01 00 22 00  00 00 00 00  00 00 00 00  00 00 00 00 
      Offset 0E0:  00 00 00 00  00 00 00 00  00 80 00 00  00 00 00 00 
      Offset 0F0:  00 00 00 00  00 00 00 00  00 00 00 00  18 E0 F2 78 

    B00 D04 F00:  Intel Skylake - Dynamic Platform & Thermal Framework Processor Participant [R0]
                  
      Offset 000:  86 80 03 19  06 00 90 00  07 00 80 11  00 00 00 00 
      Offset 010:  04 00 D2 ED  00 00 00 00  00 00 00 00  00 00 00 00 
      Offset 020:  00 00 00 00  00 00 00 00  00 00 00 00  28 10 BF 07 
      Offset 030:  00 00 00 00  90 00 00 00  00 00 00 00  10 01 00 00 
      Offset 040:  00 00 00 00  00 00 00 00  00 00 00 00  00 00 00 00 
      Offset 050:  00 00 00 00  B9 00 00 00  00 00 00 00  00 00 00 00 
      Offset 060:  00 00 00 00  00 00 00 00  00 00 00 00  00 00 00 00 
      Offset 070:  00 00 00 00  00 00 00 00  00 00 00 00  00 00 00 00 
      Offset 080:  00 00 00 00  00 00 00 00  00 00 00 00  00 00 00 00 
      Offset 090:  05 D0 00 00  00 00 00 00  00 00 00 00  00 00 00 00 
      Offset 0A0:  00 00 00 00  00 00 00 00  00 00 00 00  00 00 00 00 
      Offset 0B0:  00 00 00 00  00 00 00 00  00 00 00 00  00 00 00 00 
      Offset 0C0:  00 00 00 00  00 00 00 00  00 00 00 00  00 00 00 00 
      Offset 0D0:  01 E0 03 00  08 00 00 00  00 00 00 00  00 00 00 00 
      Offset 0E0:  09 00 0C 01  79 26 01 62  DC 00 E4 B6  00 00 00 00 
      Offset 0F0:  00 00 00 00  00 00 00 00  00 00 00 00  00 00 00 00 

    B00 D14 F00:  Intel Sunrise Point PCH - USB 3.0 xHCI Controller [D1]
                  
      Offset 000:  86 80 2F A1  06 04 90 02  31 30 03 0C  00 00 80 00 
      Offset 010:  04 00 D1 ED  00 00 00 00  00 00 00 00  00 00 00 00 
      Offset 020:  00 00 00 00  00 00 00 00  00 00 00 00  28 10 BF 07 
      Offset 030:  00 00 00 00  70 00 00 00  00 00 00 00  00 01 00 00 
      Offset 040:  FD 01 34 80  88 C6 0F 80  00 00 00 00  00 00 00 00 
      Offset 050:  5B 6E CE 0F  00 00 00 00  00 00 00 00  00 00 00 00 
      Offset 060:  30 60 00 00  00 00 00 00  00 00 00 00  00 00 00 00 
      Offset 070:  01 80 C2 C1  08 00 00 00  00 00 00 00  00 00 00 00 
      Offset 080:  05 00 87 00  D8 03 E0 FE  00 00 00 00  00 00 00 00 
      Offset 090:  09 00 14 F0  10 00 40 01  00 00 00 00  C1 0A 08 00 
      Offset 0A0:  00 08 00 00  00 18 00 00  8F 40 02 00  00 01 04 00 
      Offset 0B0:  61 C0 00 00  02 06 00 00  8C 01 00 00  00 00 00 00 
      Offset 0C0:  00 30 00 00  00 00 00 00  00 00 00 00  00 00 00 00 
      Offset 0D0:  61 00 00 00  12 02 00 00  8C 01 00 00  00 00 00 00 
      Offset 0E0:  00 00 00 00  00 00 00 00  00 00 00 00  00 00 00 00 
      Offset 0F0:  00 00 00 00  00 00 00 00  B3 0F 41 08  00 00 00 00 

    B00 D14 F02:  Intel Sunrise Point PCH - Thermal Management Controller [D1]
                  
      Offset 000:  86 80 31 A1  06 00 10 00  31 00 80 11  00 00 00 00 
      Offset 010:  04 80 D3 ED  00 00 00 00  00 00 00 00  00 00 00 00 
      Offset 020:  00 00 00 00  00 00 00 00  00 00 00 00  28 10 BF 07 
      Offset 030:  00 00 00 00  50 00 00 00  00 00 00 00  0B 03 00 00 
      Offset 040:  04 00 00 00  00 00 00 00  00 00 00 00  00 00 00 00 
      Offset 050:  01 80 23 00  08 00 00 00  00 00 00 00  00 00 00 00 
      Offset 060:  00 00 00 00  00 00 00 00  00 00 00 00  00 00 00 00 
      Offset 070:  00 00 00 00  00 00 00 00  00 00 00 00  00 00 00 00 
      Offset 080:  05 00 00 00  00 00 00 00  00 00 00 00  00 00 00 00 
      Offset 090:  00 00 00 00  00 00 00 00  00 00 00 00  00 00 00 00 
      Offset 0A0:  00 00 00 00  00 00 00 00  00 00 00 00  00 00 00 00 
      Offset 0B0:  00 00 00 00  00 00 00 00  00 00 00 00  00 00 00 00 
      Offset 0C0:  00 00 00 00  00 00 00 00  00 00 00 00  00 00 00 00 
      Offset 0D0:  00 00 00 00  00 00 00 00  00 00 00 00  00 00 00 00 
      Offset 0E0:  00 00 00 00  00 00 00 00  00 00 00 00  00 00 00 00 
      Offset 0F0:  00 00 00 00  00 00 00 00  B3 0F 41 08  00 00 00 00 

    B00 D15 F00:  Intel Sunrise Point PCH - LPSS: I2C Controller 0 [D1]
                  
      Offset 000:  86 80 60 A1  00 04 10 00  31 00 80 11  00 00 80 00 
      Offset 010:  04 D0 40 FE  00 00 00 00  00 00 00 00  00 00 00 00 
      Offset 020:  00 00 00 00  00 00 00 00  00 00 00 00  28 10 BF 07 
      Offset 030:  00 00 00 00  80 00 00 00  00 00 00 00  10 01 00 00 
      Offset 040:  00 00 00 00  00 00 00 00  00 00 00 00  00 00 00 00 
      Offset 050:  00 00 00 00  00 00 00 00  00 00 00 00  00 00 00 00 
      Offset 060:  00 00 00 00  00 00 00 00  00 00 00 00  00 00 00 00 
      Offset 070:  00 00 00 00  00 00 00 00  00 00 00 00  00 00 00 00 
      Offset 080:  01 90 03 00  0B 00 00 00  00 00 00 00  00 00 00 00 
      Offset 090:  09 00 14 F0  10 00 40 01  01 21 00 00  C1 24 00 00 
      Offset 0A0:  00 08 0F 00  00 00 00 00  00 00 00 00  00 00 00 00 
      Offset 0B0:  00 00 00 00  00 00 00 00  00 00 00 00  00 00 00 00 
      Offset 0C0:  00 00 00 00  00 00 00 00  00 00 00 00  00 00 00 00 
      Offset 0D0:  00 00 00 00  00 00 00 00  00 00 00 00  00 00 00 00 
      Offset 0E0:  00 00 00 00  00 00 00 00  00 00 00 00  00 00 00 00 
      Offset 0F0:  00 00 00 00  00 00 00 00  B3 0F 41 08  00 00 00 00 

    B00 D15 F01:  Intel Sunrise Point PCH - LPSS: I2C Controller 1 [D1]
                  
      Offset 000:  86 80 61 A1  06 00 10 00  31 00 80 11  00 00 80 00 
      Offset 010:  04 E0 40 FE  00 00 00 00  00 00 00 00  00 00 00 00 
      Offset 020:  00 00 00 00  00 00 00 00  00 00 00 00  28 10 BF 07 
      Offset 030:  00 00 00 00  80 00 00 00  00 00 00 00  11 02 00 00 
      Offset 040:  00 00 00 00  00 00 00 00  00 00 00 00  00 00 00 00 
      Offset 050:  00 00 00 00  00 00 00 00  00 00 00 00  00 00 00 00 
      Offset 060:  00 00 00 00  00 00 00 00  00 00 00 00  00 00 00 00 
      Offset 070:  00 00 00 00  00 00 00 00  00 00 00 00  00 00 00 00 
      Offset 080:  01 90 03 00  08 00 00 00  00 00 00 00  00 00 00 00 
      Offset 090:  09 00 14 F0  10 00 40 01  01 21 00 00  C1 24 00 00 
      Offset 0A0:  00 08 0F 00  00 00 00 00  00 00 00 00  00 00 00 00 
      Offset 0B0:  00 00 00 00  00 00 00 00  00 00 00 00  00 00 00 00 
      Offset 0C0:  00 00 00 00  00 00 00 00  00 00 00 00  00 00 00 00 
      Offset 0D0:  00 00 00 00  00 00 00 00  00 00 00 00  00 00 00 00 
      Offset 0E0:  00 00 00 00  00 00 00 00  00 00 00 00  00 00 00 00 
      Offset 0F0:  00 00 00 00  00 00 00 00  B3 0F 41 08  00 00 00 00 

    B00 D16 F00:  Intel Sunrise Point PCH - CSME: Host Embedded Controller Interface 1 (HECI1) [D1]
                  
      Offset 000:  86 80 3A A1  06 04 10 00  31 00 80 07  00 00 80 00 
      Offset 010:  04 F0 40 FE  00 00 00 00  00 00 00 00  00 00 00 00 
      Offset 020:  00 00 00 00  00 00 00 00  00 00 00 00  28 10 BF 07 
      Offset 030:  00 00 00 00  50 00 00 00  00 00 00 00  00 01 00 00 
      Offset 040:  45 02 00 A4  20 00 01 80  06 05 F2 00  00 00 00 00 
      Offset 050:  01 8C 03 40  08 00 00 00  00 00 00 00  00 00 00 00 
      Offset 060:  30 00 00 00  04 40 08 00  01 1F 00 00  C9 0B C0 47 
      Offset 070:  00 00 00 00  03 00 00 E0  00 00 00 00  00 00 00 00 
      Offset 080:  00 00 00 00  00 00 00 00  00 00 00 00  05 00 81 00 
      Offset 090:  78 04 E0 FE  00 00 00 00  00 00 00 00  00 00 00 00 
      Offset 0A0:  00 00 00 00  00 00 00 00  00 00 00 00  00 00 00 00 
      Offset 0B0:  00 00 00 00  00 00 00 00  00 00 00 00  00 00 00 40 
      Offset 0C0:  00 00 00 00  00 00 00 00  00 00 00 00  00 00 00 00 
      Offset 0D0:  00 00 00 00  00 00 00 00  00 00 00 00  00 00 00 00 
      Offset 0E0:  00 00 00 00  00 00 00 00  00 00 00 00  00 00 00 00 
      Offset 0F0:  00 00 00 00  00 00 00 00  B3 0F 41 08  00 00 00 00 

    B00 D17 F00:  Intel Sunrise Point PCH - SATA RAID Controller [D1]
                  
      Offset 000:  86 80 22 28  07 04 B0 02  31 00 04 01  00 00 00 00 
      Offset 010:  00 00 D3 ED  00 40 D3 ED  91 F0 00 00  81 F0 00 00 
      Offset 020:  61 F0 00 00  00 30 D3 ED  00 00 00 00  28 10 BF 07 
      Offset 030:  00 00 00 00  80 00 00 00  00 00 00 00  00 01 00 00 
      Offset 040:  00 00 00 00  00 00 00 00  00 00 00 00  00 00 00 00 
      Offset 050:  00 00 00 00  00 00 00 00  00 00 00 00  00 00 00 00 
      Offset 060:  00 00 00 00  00 00 00 00  00 00 00 00  00 00 00 00 
      Offset 070:  01 A8 03 40  08 00 00 00  00 00 00 00  00 00 00 00 
      Offset 080:  05 70 01 00  18 03 E0 FE  00 00 00 00  00 00 00 00 
      Offset 090:  00 00 FF 00  00 00 00 00  00 00 00 00  30 00 01 80 
      Offset 0A0:  3C 00 00 00  00 00 00 00  12 00 10 00  48 00 00 00 
      Offset 0B0:  00 00 00 00  00 00 00 00  00 00 00 00  00 00 00 00 
      Offset 0C0:  00 00 00 00  00 00 00 00  00 00 00 00  00 00 00 00 
      Offset 0D0:  11 00 00 00  00 00 00 00  01 00 00 00  00 00 00 00 
      Offset 0E0:  00 00 00 00  00 00 00 00  00 00 00 00  00 00 00 00 
      Offset 0F0:  00 00 00 00  00 00 00 00  B3 0F 41 08  00 00 00 00 

    B00 D1C F00:  Intel Sunrise Point PCH - PCI Express Root Port 1 [D1]
                  
      Offset 000:  86 80 10 A1  06 04 10 00  F1 00 04 06  00 00 81 00 
      Offset 010:  00 00 00 00  00 00 00 00  00 02 02 00  F0 00 00 20 
      Offset 020:  C0 ED C0 ED  F1 FF 01 00  00 00 00 00  00 00 00 00 
      Offset 030:  00 00 00 00  40 00 00 00  00 00 00 00  00 01 00 00 
      Offset 040:  10 80 42 01  01 80 00 00  07 00 10 00  13 48 72 01 
      Offset 050:  42 00 11 70  00 B2 24 00  00 00 40 01  08 00 00 00 
      Offset 060:  00 00 00 00  37 08 00 00  00 04 00 00  0E 00 00 00 
      Offset 070:  03 00 01 00  00 00 00 00  00 00 00 00  00 00 00 00 
      Offset 080:  05 90 01 00  58 01 E0 FE  00 00 00 00  00 00 00 00 
      Offset 090:  0D A0 00 00  28 10 BF 07  00 00 00 00  00 00 00 00 
      Offset 0A0:  01 00 03 C8  00 00 00 00  00 00 00 00  00 00 00 00 
      Offset 0B0:  00 00 00 00  00 00 00 00  00 00 00 00  00 00 00 00 
      Offset 0C0:  00 00 00 00  00 00 00 00  00 00 00 00  00 00 00 00 
      Offset 0D0:  01 10 00 07  42 18 00 00  08 00 9E 89  00 00 00 00 
      Offset 0E0:  00 B7 73 00  54 8C 54 8C  16 80 12 00  00 00 00 00 
      Offset 0F0:  50 01 00 00  00 03 00 40  B3 0F 41 08  00 00 00 01 

    B00 D1C F01:  Intel Sunrise Point PCH - PCI Express Root Port 2 [D1]
                  
      Offset 000:  86 80 11 A1  07 04 10 00  F1 00 04 06  00 00 81 00 
      Offset 010:  00 00 00 00  00 00 00 00  00 03 03 00  D0 D0 00 20 
      Offset 020:  10 ED A0 ED  11 D2 A1 D2  00 00 00 00  00 00 00 00 
      Offset 030:  00 00 00 00  40 00 00 00  00 00 00 00  00 02 00 00 
      Offset 040:  10 80 42 01  01 80 00 00  27 00 10 00  13 48 72 02 
      Offset 050:  40 00 12 70  60 B2 2C 00  28 10 40 00  08 00 00 00 
      Offset 060:  00 00 00 00  37 08 00 00  00 00 00 00  0E 00 00 00 
      Offset 070:  03 00 00 00  00 00 00 00  00 00 00 00  00 00 00 00 
      Offset 080:  05 90 01 00  78 01 E0 FE  00 00 00 00  00 00 00 00 
      Offset 090:  0D A0 00 00  28 10 BF 07  00 00 00 00  00 00 00 00 
      Offset 0A0:  01 00 03 C8  00 00 00 00  00 00 00 00  00 00 00 00 
      Offset 0B0:  00 00 00 00  00 00 00 00  00 00 00 00  00 00 00 00 
      Offset 0C0:  00 00 00 00  00 00 00 00  00 00 00 00  00 00 00 00 
      Offset 0D0:  11 10 00 07  42 18 00 00  0A 00 9E C9  00 00 00 00 
      Offset 0E0:  00 03 E3 00  00 00 00 00  06 00 10 00  00 00 00 00 
      Offset 0F0:  50 01 00 00  00 00 00 4C  B3 0F 41 08  00 00 00 02 

    B00 D1D F00:  Intel Sunrise Point PCH - PCI Express Root Port 9 [D1]
                  
      Offset 000:  86 80 18 A1  06 04 10 00  F1 00 04 06  00 00 81 00 
      Offset 010:  00 00 00 00  00 00 00 00  00 04 04 00  F0 00 00 20 
      Offset 020:  B0 ED B0 ED  F1 FF 01 00  00 00 00 00  00 00 00 00 
      Offset 030:  00 00 00 00  40 00 00 00  00 00 00 00  00 01 00 00 
      Offset 040:  10 80 42 01  01 80 00 00  27 00 10 00  43 48 72 09 
      Offset 050:  42 00 43 70  00 FD 64 00  00 00 40 01  08 00 00 00 
      Offset 060:  00 00 00 00  37 08 00 00  00 04 00 00  0E 00 00 00 
      Offset 070:  03 00 1F 00  00 00 00 00  00 00 00 00  00 00 00 00 
      Offset 080:  05 90 01 00  98 01 E0 FE  00 00 00 00  00 00 00 00 
      Offset 090:  0D A0 00 00  28 10 BF 07  00 00 00 00  00 00 00 00 
      Offset 0A0:  01 00 03 C8  00 00 00 00  00 00 00 00  00 00 00 00 
      Offset 0B0:  00 00 00 00  00 00 00 00  00 00 00 00  00 00 00 00 
      Offset 0C0:  00 00 00 00  00 00 00 00  00 00 00 00  00 00 00 00 
      Offset 0D0:  11 10 00 07  42 18 00 00  08 00 9E 89  00 00 00 00 
      Offset 0E0:  00 F7 F3 00  F4 89 F4 89  16 80 12 00  00 00 00 00 
      Offset 0F0:  50 01 00 00  00 03 00 40  B3 0F 41 08  00 C0 00 01 

    B00 D1D F04:  Intel Sunrise Point PCH - PCI Express Root Port 13 [D1]
                  
      Offset 000:  86 80 1C A1  04 04 10 00  F1 00 04 06  00 00 81 00 
      Offset 010:  00 00 00 00  00 00 00 00  00 05 05 00  F0 00 00 20 
      Offset 020:  F0 FF 00 00  F1 FF 01 00  00 00 00 00  00 00 00 00 
      Offset 030:  00 00 00 00  40 00 00 00  00 00 00 00  00 01 00 00 
      Offset 040:  10 80 42 00  01 80 00 00  00 00 10 00  23 7C 71 0D 
      Offset 050:  02 00 01 18  60 00 04 00  00 00 40 00  08 00 00 00 
      Offset 060:  00 00 00 00  37 08 08 00  00 04 00 00  0E 00 00 00 
      Offset 070:  01 00 01 00  00 00 00 00  00 00 00 00  00 00 00 00 
      Offset 080:  05 90 01 00  B8 01 E0 FE  00 00 00 00  00 00 00 00 
      Offset 090:  0D A0 00 00  28 10 BF 07  00 00 00 00  00 00 00 00 
      Offset 0A0:  01 00 03 C8  00 00 00 00  00 00 00 00  00 00 00 00 
      Offset 0B0:  00 00 00 00  00 00 00 00  00 00 00 00  00 00 00 00 
      Offset 0C0:  00 00 00 00  00 00 00 00  00 00 00 00  00 00 00 00 
      Offset 0D0:  11 00 00 07  00 08 00 00  02 00 9E 09  00 00 00 00 
      Offset 0E0:  00 B7 93 00  00 00 00 00  04 80 02 00  00 00 00 00 
      Offset 0F0:  50 01 00 00  00 F3 00 40  B3 0F 41 08  00 80 00 01 

    B00 D1D F06:  Intel Sunrise Point PCH - PCI Express Root Port 15 [D1]
                  
      Offset 000:  86 80 1E A1  06 04 10 00  F1 00 04 06  00 00 81 00 
      Offset 010:  00 00 00 00  00 00 00 00  00 06 3E 00  F0 00 00 20 
      Offset 020:  00 D4 00 EA  01 90 F1 B1  00 00 00 00  00 00 00 00 
      Offset 030:  00 00 00 00  40 00 00 00  00 00 00 00  00 03 00 00 
      Offset 040:  10 80 42 01  00 80 00 00  07 00 10 00  23 70 72 0F 
      Offset 050:  00 00 01 18  60 FD 94 00  28 10 40 00  08 00 00 00 
      Offset 060:  00 00 00 00  37 08 00 00  00 04 00 00  0E 00 00 00 
      Offset 070:  03 00 01 00  00 00 00 00  00 00 00 00  00 00 00 00 
      Offset 080:  05 90 01 00  D8 01 E0 FE  00 00 00 00  00 00 00 00 
      Offset 090:  0D A0 00 00  28 10 BF 07  00 00 00 00  00 00 00 00 
      Offset 0A0:  01 00 03 C8  00 00 00 00  00 00 00 00  00 00 00 00 
      Offset 0B0:  00 00 00 00  00 00 00 00  00 00 00 00  00 00 00 00 
      Offset 0C0:  00 00 00 00  00 00 00 00  00 00 00 00  00 00 00 00 
      Offset 0D0:  01 10 00 07  42 18 00 00  0A 00 9E C9  00 00 00 00 
      Offset 0E0:  00 03 E3 00  00 00 00 00  06 00 10 00  00 00 00 00 
      Offset 0F0:  50 01 00 00  00 00 00 4C  B3 0F 41 08  00 00 00 03 

    B00 D1F F00:  Intel CM238 Chipset - LPC/eSPI Controller [D1]
                  
      Offset 000:  86 80 54 A1  07 00 00 02  31 00 01 06  00 00 80 00 
      Offset 010:  00 00 00 00  00 00 00 00  00 00 00 00  00 00 00 00 
      Offset 020:  00 00 00 00  00 00 00 00  00 00 00 00  28 10 BF 07 
      Offset 030:  00 00 00 00  00 00 00 00  00 00 00 00  00 00 00 00 
      Offset 040:  00 00 00 00  00 00 00 00  00 00 00 00  00 00 00 00 
      Offset 050:  00 00 00 00  00 00 00 00  00 00 00 00  00 00 00 00 
      Offset 060:  00 00 00 00  D0 00 00 00  00 00 00 00  00 00 00 00 
      Offset 070:  00 00 00 00  00 00 00 00  00 00 00 00  00 00 00 00 
      Offset 080:  70 00 03 1C  30 FC DC 00  81 06 7C 00  E1 07 1C 00 
      Offset 090:  01 09 7C 00  00 0F 00 00  00 00 00 00  00 00 00 00 
      Offset 0A0:  00 00 00 00  00 00 00 00  00 00 00 00  00 00 00 00 
      Offset 0B0:  00 00 00 00  00 00 00 00  00 00 00 00  00 00 00 00 
      Offset 0C0:  00 00 00 00  00 00 00 00  00 00 00 00  00 00 00 00 
      Offset 0D0:  33 22 11 00  67 45 00 00  CF FF 00 00  A2 00 00 00 
      Offset 0E0:  C1 00 00 00  00 00 00 00  00 00 00 00  00 00 00 00 
      Offset 0F0:  00 00 00 00  00 00 00 00  B3 0F 41 08  00 00 00 00 

    B00 D1F F02:  Intel Sunrise Point PCH - Power Management Controller (PMC) [D1]
                  
      Offset 000:  86 80 21 A1  06 00 00 00  31 00 80 05  00 00 80 00 
      Offset 010:  00 C0 D2 ED  00 00 00 00  00 00 00 00  00 00 00 00 
      Offset 020:  00 00 00 00  00 00 00 00  00 00 00 00  28 10 BF 07 
      Offset 030:  00 00 00 00  00 00 00 00  00 00 00 00  00 00 00 00 
      Offset 040:  01 18 00 00  80 01 00 00  00 00 00 FE  00 00 00 00 
      Offset 050:  00 00 00 00  00 00 00 00  00 00 00 00  00 00 00 00 
      Offset 060:  00 00 00 00  00 00 00 00  00 00 00 00  00 00 00 00 
      Offset 070:  00 00 00 00  00 00 00 00  00 00 00 00  00 00 00 00 
      Offset 080:  00 00 00 00  00 00 00 00  00 00 00 00  00 00 00 00 
      Offset 090:  00 00 00 00  00 00 00 00  00 00 00 00  00 00 00 00 
      Offset 0A0:  F8 36 80 E0  49 18 06 00  00 46 00 00  00 00 00 81 
      Offset 0B0:  00 00 00 00  00 00 00 00  00 00 00 00  00 00 00 00 
      Offset 0C0:  00 00 00 00  00 00 00 00  00 00 00 00  00 00 00 00 
      Offset 0D0:  00 00 00 00  00 00 00 00  00 00 00 00  00 00 00 00 
      Offset 0E0:  00 00 00 00  00 00 00 00  00 00 00 00  00 00 00 00 
      Offset 0F0:  00 00 00 00  00 00 00 00  B3 0F 41 08  00 00 00 00 

    B00 D1F F03:  Intel Sunrise Point PCH - High Definition Audio Controller [D1]
                  
      Offset 000:  86 80 71 A1  06 04 10 00  31 80 03 04  00 20 00 00 
      Offset 010:  04 80 D2 ED  00 00 00 00  00 00 00 00  00 00 00 00 
      Offset 020:  04 00 D0 ED  00 00 00 00  00 00 00 00  28 10 BF 07 
      Offset 030:  00 00 00 00  50 00 00 00  00 00 00 00  00 02 00 00 
      Offset 040:  00 00 00 00  18 00 00 00  FF 0D 3B 80  00 00 00 00 
      Offset 050:  01 60 43 C0  08 00 00 00  00 00 00 00  00 00 00 00 
      Offset 060:  05 00 81 00  38 03 E0 FE  00 00 00 00  00 00 00 00 
      Offset 070:  10 00 91 00  00 00 00 10  00 28 10 00  00 00 00 00 
      Offset 080:  00 00 00 00  00 00 00 00  00 00 00 00  00 00 00 00 
      Offset 090:  00 00 00 00  00 00 00 00  00 00 00 00  00 00 00 00 
      Offset 0A0:  00 00 00 00  00 00 00 00  00 00 00 00  00 00 00 00 
      Offset 0B0:  00 00 00 00  00 00 00 00  00 00 00 00  00 00 00 00 
      Offset 0C0:  08 06 02 00  00 70 80 04  00 0C A5 82  10 00 03 00 
      Offset 0D0:  00 0C B5 02  10 00 03 00  00 00 00 00  00 00 00 00 
      Offset 0E0:  00 00 00 00  00 00 00 00  00 00 00 00  00 00 00 00 
      Offset 0F0:  00 00 00 00  00 00 00 00  B3 0F 41 08  00 00 00 00 

    B00 D1F F04:  Intel Sunrise Point PCH - SMBus Controller [D1]
                  
      Offset 000:  86 80 23 A1  03 00 80 02  31 00 05 0C  00 00 00 00 
      Offset 010:  04 20 D3 ED  00 00 00 00  00 00 00 00  00 00 00 00 
      Offset 020:  41 F0 00 00  00 00 00 00  00 00 00 00  28 10 BF 07 
      Offset 030:  00 00 00 00  00 00 00 00  00 00 00 00  0B 01 00 00 
      Offset 040:  11 00 00 00  00 00 00 00  00 00 00 00  00 00 00 00 
      Offset 050:  01 04 00 00  00 01 00 00  00 00 00 00  00 00 00 00 
      Offset 060:  04 05 05 00  00 00 0A 0A  00 00 00 00  00 00 00 00 
      Offset 070:  00 00 00 00  00 00 00 00  00 00 00 00  00 00 00 00 
      Offset 080:  24 00 04 00  00 00 00 00  00 00 00 00  00 00 00 00 
      Offset 090:  00 00 00 00  00 00 00 00  00 00 00 00  00 00 00 00 
      Offset 0A0:  00 00 00 00  00 00 00 00  00 00 00 00  00 00 00 00 
      Offset 0B0:  00 00 00 00  00 00 00 00  00 00 00 00  00 00 00 00 
      Offset 0C0:  00 00 00 00  00 00 00 00  00 00 00 00  00 00 00 00 
      Offset 0D0:  00 00 00 00  00 00 00 00  00 00 00 00  00 00 00 00 
      Offset 0E0:  00 00 00 00  00 00 00 00  00 00 00 00  00 00 00 00 
      Offset 0F0:  00 00 00 00  00 00 00 00  B3 0F 41 08  00 00 00 00 

    B02 D00 F00:  Intel Dual Band Wireless-AC 8265 WiFi Adapter
                  
      Offset 000:  86 80 FD 24  06 04 10 00  78 00 80 02  00 00 00 00 
      Offset 010:  04 00 C0 ED  00 00 00 00  00 00 00 00  00 00 00 00 
      Offset 020:  00 00 00 00  00 00 00 00  00 00 00 00  86 80 50 00 
      Offset 030:  00 00 00 00  C8 00 00 00  00 00 00 00  00 01 00 00 
      Offset 040:  10 00 02 00  C0 8E 00 10  17 04 19 00  11 E8 45 00 
      Offset 050:  42 01 11 10  00 00 00 00  00 00 00 00  00 00 00 00 
      Offset 060:  00 00 00 00  12 08 08 00  05 04 00 00  00 00 00 00 
      Offset 070:  01 00 01 00  00 00 00 00  00 00 00 00  00 00 00 00 
      Offset 080:  00 00 00 00  00 00 00 00  00 00 00 00  00 00 00 00 
      Offset 090:  00 00 00 00  00 00 00 00  00 00 00 00  00 00 00 00 
      Offset 0A0:  00 00 00 00  00 00 00 00  00 00 00 00  00 00 00 00 
      Offset 0B0:  00 00 00 00  00 00 00 00  00 00 00 00  00 00 00 00 
      Offset 0C0:  00 00 00 00  00 00 00 00  01 D0 23 C8  00 00 00 0D 
      Offset 0D0:  05 40 81 00  98 03 E0 FE  00 00 00 00  00 00 00 00 
      Offset 0E0:  00 00 00 00  00 00 00 00  00 00 00 00  00 00 00 00 
      Offset 0F0:  00 00 00 00  00 00 00 00  00 00 00 00  00 00 00 00 

    B03 D00 F00:  Realtek PCI-E Card Reader
                  
      Offset 000:  EC 10 5A 52  06 00 10 00  01 00 00 FF  00 00 00 00 
      Offset 010:  00 00 00 00  00 00 10 ED  00 00 00 00  00 00 00 00 
      Offset 020:  00 00 00 00  00 00 00 00  00 00 00 00  28 10 BF 07 
      Offset 030:  00 00 00 00  80 00 00 00  00 00 00 00  0A 01 00 00 
      Offset 040:  00 00 00 00  00 00 00 00  00 00 00 00  00 00 00 00 
      Offset 050:  00 00 00 00  00 00 00 00  00 00 00 00  00 00 00 00 
      Offset 060:  00 00 00 00  00 00 00 00  00 00 00 00  00 00 00 00 
      Offset 070:  00 00 00 00  00 00 00 00  00 00 00 00  00 00 00 00 
      Offset 080:  01 90 C3 F7  00 00 00 00  00 00 00 00  00 00 00 00 
      Offset 090:  05 B0 80 00  00 00 00 00  00 00 00 00  00 00 00 00 
      Offset 0A0:  00 00 00 00  00 00 00 00  00 00 00 00  00 00 00 00 
      Offset 0B0:  10 00 02 00  C2 8F 90 05  30 20 19 00  12 7C 47 00 
      Offset 0C0:  42 01 12 10  00 00 00 00  00 00 00 00  00 00 00 00 
      Offset 0D0:  00 00 00 00  10 08 0C 00  00 04 00 00  06 00 00 00 
      Offset 0E0:  02 00 00 00  00 00 00 00  00 00 00 00  0F FF 3B 3E 
      Offset 0F0:  00 00 00 00  00 00 00 00  00 00 00 00  00 00 00 00 

    B04 D00 F00:  Toshiba AIS NVMe SSD Controller
                  
      Offset 000:  79 11 16 01  06 04 10 00  00 02 08 01  00 00 00 00 
      Offset 010:  04 00 B0 ED  00 00 00 00  00 00 00 00  00 00 00 00 
      Offset 020:  00 00 00 00  00 00 00 00  00 00 00 00  79 11 01 00 
      Offset 030:  00 00 00 00  40 00 00 00  00 00 00 00  00 01 00 00 
      Offset 040:  10 80 02 00  C1 8F E8 17  27 20 09 00  43 D8 42 00 
      Offset 050:  42 00 43 10  00 00 00 00  00 00 00 00  00 00 00 00 
      Offset 060:  00 00 00 00  13 08 10 00  00 04 00 00  0E 00 00 00 
      Offset 070:  03 00 1E 00  00 00 00 00  00 00 00 00  00 00 00 00 
      Offset 080:  01 90 03 00  08 00 00 00  00 00 00 00  00 00 00 00 
      Offset 090:  05 B0 8A 01  00 00 00 00  00 00 00 00  00 00 00 00 
      Offset 0A0:  00 00 00 00  00 00 00 00  00 00 00 00  00 00 00 00 
      Offset 0B0:  11 00 1F 80  00 20 00 00  00 30 00 00  00 00 00 00 
      Offset 0C0:  00 00 00 00  00 00 00 00  00 00 00 00  00 00 00 00 
      Offset 0D0:  00 00 00 00  00 00 00 00  00 00 00 00  00 00 00 00 
      Offset 0E0:  00 00 00 00  00 00 00 00  00 00 00 00  00 00 00 00 
      Offset 0F0:  00 00 00 00  00 00 00 00  00 00 00 00  00 00 00 00 

    PCI-8086-1910:  Intel SNB/IVB/HSW/CRW/BDW/SKL/KBL/CFL/WHL/CNL/CML/ICL/RKL/TGL/JSL/EHL MCHBAR
                  
      Offset 4000:  11 27 09 26  1A 46 02 00  86 9D 16 26  06 04 06 07
      Offset 4010:  09 09 09 0B  1E 18 05 06  06 04 07 07  34 45 00 0C
      Offset 4020:  38 38 45 45  66 44 15 0E  00 00 00 00  04 00 00 00
      Offset 4030:  00 00 00 00  00 0C 00 00  40 00 00 01  40 00 60 00
      Offset 4040:  80 20 00 00  46 00 00 00  00 00 00 00  00 00 00 00
      Offset 4050:  00 00 00 00  10 32 54 76  00 00 00 00  00 00 00 00
      Offset 4060:  00 00 00 00  00 00 00 00  38 28 3F 38  10 10 40 00
      Offset 4070:  10 00 F1 2D  00 00 00 00  00 C6 00 00  00 00 00 00
      Offset 4080:  00 00 00 00  00 00 00 00  00 00 00 00  00 00 00 00

    PCI-8086-1910:  Intel SNB/IVB/HSW/CRW/BDW/SKL/KBL/CFL/WHL/CNL/CML/ICL/RKL/TGL/JSL/EHL MCHBAR
                  
      Offset 4200:  00 00 3F 00  00 00 00 00  00 00 00 00  00 00 00 00
      Offset 4210:  00 0D 20 01  46 18 F9 17  C3 C3 C3 C3  C3 C3 C3 C3
      Offset 4220:  00 00 00 00  03 03 03 03  00 00 01 01  00 00 00 00
      Offset 4230:  10 02 21 20  10 02 21 64  40 98 00 A2  94 24 A4 01
      Offset 4240:  00 53 00 62  00 40 00 00  80 00 02 00  E8 08 00 00
      Offset 4250:  00 00 00 00  03 00 00 00  00 00 00 00  00 00 00 00
      Offset 4260:  0B 00 00 00  07 00 00 00  8F 00 00 00  C8 00 00 00
      Offset 4270:  96 00 00 00  FF FF FF FF  0A 00 00 80  00 00 00 00
      Offset 4280:  00 00 00 00  00 00 00 00  00 00 00 00  00 00 00 00
      Offset 4290:  00 70 00 00  00 00 00 00  00 00 00 00  FF FF FF FF
      Offset 42A0:  FF FF FF FF  00 00 00 00  10 32 54 76  00 00 00 00

    PCI-8086-1910:  Intel SNB/IVB/HSW/CRW/BDW/SKL/KBL/CFL/WHL/CNL/CML/ICL/RKL/TGL/JSL/EHL MCHBAR
                  
      Offset 4400:  08 1C 06 18  10 44 02 00  44 44 04 04  04 04 04 04
      Offset 4410:  04 04 04 04  04 04 04 04  04 04 04 04  10 10 00 02
      Offset 4420:  19 19 19 19  00 00 15 0E  00 00 00 00  04 00 00 00
      Offset 4430:  00 00 00 00  00 0C 00 00  40 00 00 01  40 00 60 00
      Offset 4440:  80 20 00 00  46 00 00 00  00 00 00 00  00 00 00 00
      Offset 4450:  00 00 00 00  10 32 54 76  00 00 00 00  00 00 00 00
      Offset 4460:  00 00 00 00  00 00 00 00  38 28 3F 38  10 10 40 00
      Offset 4470:  00 00 C5 10  00 00 00 00  00 C6 00 00  00 00 00 00
      Offset 4480:  00 00 00 00  00 00 00 00  00 00 00 00  00 00 00 00

    PCI-8086-1910:  Intel SNB/IVB/HSW/CRW/BDW/SKL/KBL/CFL/WHL/CNL/CML/ICL/RKL/TGL/JSL/EHL MCHBAR
                  
      Offset 4600:  00 00 3F 00  00 00 00 00  00 00 00 00  00 00 00 00
      Offset 4610:  05 00 00 01  00 00 00 00  00 00 00 00  00 00 00 00
      Offset 4620:  00 00 00 00  03 03 03 03  01 01 01 01  00 00 00 00
      Offset 4630:  10 02 21 20  10 02 21 64  0F 98 00 46  04 10 B4 00
      Offset 4640:  00 02 00 01  00 00 00 00  80 00 01 00  00 00 00 00
      Offset 4650:  00 00 00 00  10 00 00 00  00 00 00 00  00 00 00 00
      Offset 4660:  00 00 00 00  00 00 00 00  00 00 00 00  00 00 00 00
      Offset 4670:  00 00 00 00  FF FF FF FF  00 00 00 00  00 00 00 00
      Offset 4680:  00 00 00 00  00 00 00 00  00 00 00 00  00 00 00 00
      Offset 4690:  00 00 00 00  00 00 00 00  00 00 00 00  00 00 00 00
      Offset 46A0:  00 00 00 00  00 00 00 00  10 32 54 76  00 00 00 00

    PCI-8086-1910:  Intel SNB/IVB/HSW/CRW/BDW/SKL/KBL/CFL/WHL/CNL/CML/ICL/RKL/TGL/JSL/EHL MCHBAR
                  
      Offset 4800:  00 00 00 00  00 00 03 00  00 00 00 08  00 00 00 08
      Offset 4810:  00 00 00 08  00 00 00 08  00 00 00 08  00 00 00 08

    PCI-8086-1910:  Intel SNB/IVB/HSW/CRW/BDW/SKL/KBL/CFL/WHL/CNL/CML/ICL/RKL/TGL/JSL/EHL MCHBAR
                  
      Offset 4A80:  00 00 00 00  00 00 00 00  00 00 00 00  00 00 00 00
      Offset 4A90:  00 00 00 00  00 00 00 00  00 00 00 00  00 00 00 00

    PCI-8086-1910:  Intel SNB/IVB/HSW/CRW/BDW/SKL/KBL/CFL/WHL/CNL/CML/ICL/RKL/TGL/JSL/EHL MCHBAR
                  
      Offset 5000:  00 00 00 00  10 01 00 00  00 00 00 00  10 04 00 00
      Offset 5010:  00 00 00 00  00 00 00 00  13 00 00 00  00 00 00 00

    PCI-8086-1910:  Intel SNB/IVB/HSW/CRW/BDW/SKL/KBL/CFL/WHL/CNL/CML/ICL/RKL/TGL/JSL/EHL MCHBAR
                  
      Offset 5880:  60 01 00 00  05 00 00 00  00 00 00 00  00 00 00 00
      Offset 5890:  FF FF 00 00  FF FF 00 00  FF FF 00 00  FF FF 00 00
      Offset 58A0:  00 00 00 00  07 00 00 00  81 36 00 00  00 00 00 00
      Offset 58B0:  00 00 00 00  00 00 00 00  00 00 00 00  7F 00 00 00
      Offset 58C0:  00 00 00 00  00 00 00 00  00 00 00 00  00 00 00 00
      Offset 58D0:  FF FF 00 00  FF FF 00 00  FF FF 00 00  FF FF 00 00
      Offset 58E0:  00 00 00 00  DE 00 54 00  5D A3 7A 00  00 00 00 00
      Offset 58F0:  00 00 00 00  00 00 00 00  16 00 28 00  00 00 01 39
      Offset 5900:  00 00 00 29  00 00 00 01  00 00 00 00  02 00 00 00
      Offset 5910:  00 00 00 00  00 00 00 00  12 08 00 14  00 00 00 00
      Offset 5920:  09 00 00 00  0D 00 00 00  10 CE D0 06  E7 F6 0D 01
      Offset 5930:  68 01 00 00  00 00 00 00  03 0E 0A 00  90 C9 58 0A
      Offset 5940:  77 98 A4 03  40 C3 6A 00  69 1B 36 00  00 00 00 00
      Offset 5950:  00 00 00 00  00 00 14 00  00 1B 01 F1  3B 08 08 00
      Offset 5960:  A0 A1 16 01  00 00 00 00  C0 9A 0E 95  8F 4D F9 EF
      Offset 5970:  00 00 00 00  0C 4F 3E 10  2B 00 00 00  29 00 00 00
      Offset 5980:  2B 00 00 00  13 F5 8A 03  00 00 00 00  00 00 00 00
      Offset 5990:  00 00 00 00  15 00 00 00  15 07 07 00  00 00 64 03
      Offset 59A0:  68 81 DD 00  C0 81 42 00  00 00 00 00  00 00 00 00
      Offset 59B0:  00 00 00 00  00 00 00 00  00 00 00 00  00 00 00 00
      Offset 59C0:  08 08 39 88  00 00 00 00  00 00 00 00  00 00 00 00

    PCI-8086-1910:  Intel SNB/IVB/HSW/CRW/BDW/SKL/KBL/CFL/WHL/CNL/CML/ICL/RKL/TGL/JSL/EHL MCHBAR
                  
      Offset 5E00:  09 00 00 00  09 00 00 00  00 00 00 00  00 00 00 00
      Offset 5E10:  00 00 00 00  00 00 00 00  00 00 00 00  00 00 00 00

    PCI-8086-A131:  Intel 100/200-series PCH TBAR
                  
      Offset 00:  CA 00 00 00  81 00 10 00  81 00 01 00  80 00 00 00
      Offset 10:  4A 01 00 00  00 00 00 00  00 00 00 00  C8 CA 00 00
      Offset 20:  00 00 00 00  00 00 00 00  00 00 00 00  00 00 00 00
      Offset 30:  00 00 00 00  00 00 00 00  00 00 00 00  00 00 00 00
      Offset 40:  3C 09 85 B4  00 00 00 00  00 00 00 00  00 00 00 00
      Offset 50:  00 80 00 00  00 00 00 00  00 00 00 00  00 00 00 00
      Offset 60:  00 00 01 00  00 00 00 00  00 00 00 00  00 00 00 00
      Offset 70:  00 00 00 00  00 00 00 00  00 00 00 00  00 00 00 00
      Offset 80:  01 00 00 00


--------[ Debug - Video BIOS ]------------------------------------------------------------------------------------------

    C000:0000  U.....000000000000./....@...00IBM VGA Compatible BIOS. .H.X.f...
    C000:0040  PCIR............................2.:.-..Y.Y.Y.Y.Y.Y......+.;.=..Y
    C000:0080  .Y;Y.Y......&.'.#.!..Y.Y&Y.Y!Y#Y'Y.....Y.Y.Y..@.A.B.C.D.E.F.G.H.
    C000:00C0  K.N.P.Q.R.S.V.X.@.A.B.C.D.E.F.G.H.I.J.K.L.M.N.O.P.Q.R.S.T.U.....
    C000:0100  ................................................................
    C000:0140  ......H...............b.........................................
    C000:0180  .................DH.....DH.....DH....0DH.....DI.....DI.....DJ...
    C000:01C0  ..DJ....0DJ.....DI....0DI.....DJ.....DK.....DK.....DK....0.L....
    C000:0200  ..L......L....0.L......M......M.....0....2.B..4.f..8....:....<..
    C000:0240  ..A....C.B..E.f..I....K....M....P ...R B..T f..X ...Z ...\ ...`.
    C000:0280  ...a....b ...c....d....e ...f....g....h ...i.5..j.5..k 5..l.O..m
    C000:02C0  .O..n O..o.i..p.i..q i..}.f..~.f.. f....... .-..`............ .
    C000:0300  1..l...........rQ.. n(U...!....... ....`"........... ....@......
    C000:0340  .... .1X. (.........V. .1X. .P........d..@A.&0..6.......... A. 0
    C000:0380  .`........0*..Q.*@0p.........4..Q.*@..........H?@0b.2@@.........
    C000:03C0  h[..r.<P....................E...................................


------------------------------------------------------------------------------------------------------------------------

The names of actual companies and products mentioned herein may be the trademarks of their respective owners.
